{
  "schemaVersion": 1,
  "jobId": "3f1c2a9e-6b1d-4c7e-9a52-0d8f5e3b7a10",
  "detectedLanguage": "es",
  "device": "cpu",
  "durationSeconds": 123.4,
  "segmentCount": 42,
  "artifacts": {
    "srt": "jobs/3f1c2a9e-6b1d-4c7e-9a52-0d8f5e3b7a10/out/output.srt",
    "segments": {
      "bucket": "captionforge",
      "objectKey": "jobs/3f1c2a9e-6b1d-4c7e-9a52-0d8f5e3b7a10/out/segments.json",
      "etag": "9b2cf535f27731c974343645a3985328"
    },
    "waveform": "jobs/3f1c2a9e-6b1d-4c7e-9a52-0d8f5e3b7a10/out/waveform.json"
  }
}
